propuestas,organizador,facultad,nombre
"Denunciar a María Manuela Flores Capdevila","Bartolomé Carro Múgica","Ciencias Económicas","Universidad Rovira i Virgili"
"Hablar con Jose Guillen-Vaquero","Gustavo Reina-Badía","Ciencias de la Salud","Universidad de La Laguna"
"Quitar el busto de Telmo Cabello Mir","Celestino Samuel Esparza Robledo","Ciencias Físicas y Matemáticas","Universidad Internacional Isabel I de Castilla"
"Quitar el busto de Renata Juan Infante","Isidro del Mariño",Arquitectura,"Universidad IE"
"Quitar el busto de Vinicio Cornejo Carreras","Javiera Chus Fuente Oliva",Matemática,"Universidad Internacional de La Rioja"
"Denunciar a Visitación Bou-Barreda","Jose Ignacio Jaén Carrera",Derecho,"Universidad de Zaragoza"
"Echar a Elba Becerra-Naranjo","Luis Miguel Saez Benavent",Filosofía,"Universidad Pontificia Comillas"
"Quitar el busto de Nicodemo Canales","Ricarda Beatriz Giménez Galvez",Medicina,"Universidad Politécnica de Madrid"
"Quitar el busto de Adora de Arnaiz","Leoncio del Alemán",Química,"Universidad de Cantabria"
"Denunciar a Nazario Rosado Cervera","Manolo Cabrera Echeverría","Ciencias Exactas","Universidad Nacional de Educación a Distancia"
"Hablar con Mauricio Cabo Ávila","Charo Corona Moreno Ugarte","Ciencias Sociales","Universidad de Valladolid"
"Denunciar a Cruz Luisina Cabo Durán","Josefa Herrera","Ciencias Físicas y Matemáticas","Universidad Jaime I"
"Echar a Abel Fuster Abad","Agapito de Acosta",Filosofía,"Universidad de Sevilla"
"Denunciar a Martín Rojas","Ruperto Albero Caparrós",Matemática,"Universidad Rey Juan Carlos"
"Hablar con Celestina Daza Reig","Maxi Bartolomé Bermúdez",Veterinaria,"Universidad de Alicante"
"Quitar el busto de Nadia González Farré","Sandalio Aranda Paniagua",Derecho,"Universidad Politécnica de Valencia"
"Quitar el busto de Casemiro Menendez Borja","Cintia Ariño Arrieta",Medicina,"Universidad Católica San Antonio"
"Echar a Matías Lozano Valle","Emma de Quiroga","Ciencias de la Salud","Universidad Internacional de la Empresa"
"Quitar el busto de Marcia Vázquez","Pío Teófilo Pozuelo Esteve",Diseño,"Universidad Europea del Atlántico"
"Hablar con Úrsula Garmendia-Huertas","Marc Angulo Barberá",Odontología,"Universidad Católica San Antonio"
"Hablar con Duilio Royo Luque","Óscar Montaña Mascaró",Química,"Universidad de Gerona"
"Quitar el busto de Efraín Aliaga","Odalys Font Luque",Arquitectura,"Universidad Politécnica de Madrid"
"Quitar el busto de Cristina Garcia","Georgina Vallés Llorens",Comunicación,"Universidad Internacional Isabel I de Castilla"
"Quitar el busto de Nico León Álamo","Albino Fito Durán Conesa",Información,"Universidad de Oviedo"
"Hablar con Eusebia Salamanca Cabezas","Maxi Mínguez Bárcena","Educación Física","Universidad Antonio de Nebrija"
"Hablar con Antonia Salamanca Campo","Tristán Múñiz","Ciencias Sociales","Universidad Autónoma de Madrid"
"Quitar el busto de Jordán de Villena","Cecilio Verdejo Palma","Ciencias Sociales","Universidad CEU Cardenal Herrera"
"Hablar con Lorenza del Domínguez","Bibiana Paredes Salinas","Ciencias Sociales","Universidad Ramon Llull"
"Quitar el busto de Cirino Suárez Núñez","Jose Miguel Batlle Lozano",Filosofía,"Universidad de Vich"
"Denunciar a Rufino Morales Galán","Ruth Pineda Guerrero",Psicología,"Universidad de Las Palmas de Gran Canaria"
"Echar a Plinio Rebollo","Lucila del Andreu",Medicina,"Universidad Pompeu Fabra"
"Hablar con Isidro Galvez Castellanos","Aarón Cifuentes Carreras","Ciencias Exactas","Universidad de Gerona"
"Hablar con Ruth Chamorro Roman","José Company Bonet","Ciencias Físicas y Matemáticas","Universidad Francisco de Vitoria"
"Echar a Valentina Rius Muro","Águeda Campoy Escudero","Ciencias Exactas","Universidad Jaime I"
"Quitar el busto de Nidia Macarena Andrés Montaña","Roldán Borrego Sans","Ciencias de la Educación","Universidad Europea Miguel de Cervantes"
"Echar a Nazaret Solé-Cervantes","Germán de Salvà",Matemática,"Universidad de Jaén"
"Quitar el busto de Iris Cepeda Machado","Arsenio Navarro Oller",Agronomía,"Universidad de Castilla-La Mancha"
"Quitar el busto de Miguela Pujadas Sánchez","Fausto Llano",Odontología,"Universidad Internacional Menéndez Pelayo"
"Denunciar a Agustina Cobo","Hernando Murcia Millán",Derecho,"Universidad de las Islas Baleares"
"Quitar el busto de Maximiliano Berenguer Campillo","Rita Caparrós Torre",Filosofía,"Universidad de Málaga"
"Hablar con Pía Carmona Planas","Reyes Sobrino Quevedo","Ciencias de la Salud","Universidad de Sevilla"
"Hablar con Prudencia Llano Borrego","Jenaro Lumbreras Marí","Ciencias de la Salud","Universidad San Jorge"
"Echar a Josep Morán Vázquez","Máximo de Bayona",Odontología,"Universidad de Cantabria"
"Echar a Reyna Iglesias","Débora Reina Aliaga","Ciencias Sociales","Universidad Francisco de Vitoria"
"Quitar el busto de Sandalio Gargallo","Baltasar Zaragoza Dueñas","Ciencias Económicas","Universidad de Castilla-La Mancha"
"Hablar con Dafne Gámez Espinosa","Aroa Iriarte Benito","Educación Física","Universidad Internacional de La Rioja"
"Echar a Remigio Aragón Chacón","Leonor Rodrigo",Información,"Universidad Internacional de Cataluña"
"Denunciar a Adrián Higueras Sanjuan","Adelardo Artemio Sobrino Daza",Información,"Universidad a Distancia de Madrid"
"Denunciar a Reyes Tenorio","Anselma Carvajal Nicolás","Ciencias Económicas","Universidad Loyola Andalucía"
"Denunciar a Nacio Casado-Ferreras","Nayara del Quintero",Humanidades,"Universidad Politécnica de Madrid"
"Denunciar a Roxana del Domínguez","Socorro Boix Gelabert",Información,"Universidad de La Rioja"
"Echar a Amanda Tomé","Eustaquio Burgos",Matemática,"Universidad de Málaga"
"Denunciar a Valerio del Julián","Jesús Somoza Araujo",Psicología,"Universidad Católica San Antonio"
"Echar a Araceli Carlos Manso","Isa Sierra Díaz",Arquitectura,"Universidad Politécnica de Cataluña"
"Denunciar a Wálter Villanueva","Angelina Alcázar","Ciencias de la Salud","Universidad de La Coruña"
"Hablar con Javiera Román Pi","Alcides Arellano Verdugo","Ciencias de la Educación","Universidad de Diseño, Innovación y Tecnología"
"Hablar con Armida Jaume Iglesias","Encarnita Almeida Porcel",Derecho,"Universidad Europea del Atlántico"
"Denunciar a Estrella del Cañizares","Nacho Solano Nicolás",Química,"Universidad Internacional de La Rioja"
"Quitar el busto de Amor Roldán Chico","Anna Diez Gómez",Diseño,"Universidad a Distancia de Madrid"
"Quitar el busto de Esteban Salgado Sanchez","Almudena Luisa Manzanares Alba","Ciencias Exactas","Universidad Internacional de La Rioja"
"Hablar con Godofredo Royo Borrás","Catalina Calista Roldán Barriga",Humanidades,"Universidad Complutense de Madrid"
"Hablar con Lorena Ribes Madrid","Malena Aroca Crespi","Ciencias Exactas","Universidad de Castilla-La Mancha"
"Quitar el busto de José Luis Millán Agudo","Hector Carrera","Ciencias de la Educación","Universidad Europea de Madrid"
"Hablar con Jacinta Salas Blazquez","Paulino Perea Rebollo",Filosofía,"Universidad de Salamanca"
"Hablar con Julia Moll Tamayo","Arturo Sacristán Lledó","Ciencias de la Educación","Universidad Católica San Antonio"
"Echar a Mirta del Ledesma","Miguel Ángel Iriarte Bravo",Psicología,"Universidad Europea del Atlántico"
"Quitar el busto de Balduino Serna Martí","Jacinta Barral Barrena","Ciencias Económicas","Universidad Fernando Pessoa-Canarias"
"Quitar el busto de Pastor Pulido Aliaga","Zaida Franco-Ropero",Derecho,"Universidad de Oviedo"
"Echar a Maximiano Guerra Requena","Juan Antonio Ramírez Ugarte","Ciencias de la Educación","Universidad Jaime I"
"Quitar el busto de Fito de Escrivá","Jaime Heredia Fonseca",Medicina,"Universidad Católica de Valencia San Vicente Mártir"
"Hablar con Glauco de Pallarès","Nuria Carrillo Barberá",Matemática,"Universidad Pontificia Comillas"
"Echar a Piedad Busquets Galindo","Zaida Suárez",Información,"Universidad de La Laguna"
"Hablar con Jimena de Rico","Azahara Céspedes",Odontología,"Universidad CEU San Pablo"
"Denunciar a Genoveva Manrique Peralta","Clotilde Agudo",Comunicación,"Universidad Católica San Antonio"
"Quitar el busto de Delia Mulet Losa","Loreto Mendoza Catalán",Medicina,"Universidad Politécnica de Valencia"
"Denunciar a Natividad Guzmán Acero","Bartolomé Querol-Matas","Ciencias Exactas","Universidad Tecnológica Atlántico-Mediterráneo"
"Hablar con Lucio Bello Giner","Pánfilo Cal-Angulo","Ciencias Físicas y Matemáticas","Universidad Nacional de Educación a Distancia"
"Echar a Clotilde Guardia Caballero","Calisto Bernal","Ciencias Físicas y Matemáticas","Universidad Complutense de Madrid"
"Quitar el busto de Jessica Jordán Serrano","Modesta Galvez Armas",Química,"ESIC Universidad"
"Quitar el busto de Mercedes Abella Santamaría","Chus Expósito-Garrido",Diseño,"Universidad Internacional Villanueva"
"Quitar el busto de Malena Ferrándiz Pons","Juana Maldonado Rey",Derecho,"Universidad de Oviedo"
"Quitar el busto de Gloria Villaverde Luján","Isidoro Zamora",Información,"Universidad de Salamanca"
"Hablar con Febe Carlos Córdoba","Raúl Candelario Amores Taboada","Ciencias Económicas","CUNEF Universidad"
"Denunciar a Cirino Bastida Parejo","Melisa Casanovas Marti",Humanidades,"Universidad de La Rioja"
"Echar a Esperanza Castañeda Piñol","David del Valcárcel",Filosofía,"Universidad Politécnica de Cartagena"
"Echar a Juan Antonio Gisbert Pagès","Pancho Cuéllar-Santamaria","Ciencias Económicas","Universidad CEU Cardenal Herrera"
"Echar a Benigna de Carreño","Nieves Tirado","Ciencias de la Educación","Universidad Intercontinental de la Empresa"
"Echar a Jesusa Cisneros","Delia del Castells",Agronomía,"Universidad de Zaragoza"
"Echar a Carina Ferrández-Lucas","Salvador Hervia Hidalgo","Ciencias Exactas","Universidad Católica Santa Teresa de Jesús de Ávila"
"Echar a Primitiva del Berrocal","Andrés del Pascual","Ciencias Económicas","Universidad Pontificia Comillas"
"Echar a Andrea Bonet Velázquez","Flavio Egea-Lledó",Diseño,"Universidad de Oviedo"
"Echar a Noemí Jordá Guzman","Mauricio Español Melero",Ingeniería,"Universidad de La Coruña"
"Echar a Paulina Ibáñez Linares","Belén Llopis Quesada","Ciencias de la Salud","Universidad Carlos III de Madrid"
"Denunciar a Amaro Ramirez Peralta","Carla Prieto Rocamora","Ciencias Exactas","Universidad de Vigo"
"Quitar el busto de Samuel Quirós Sanz","Isaías Amat-Carballo",Filosofía,"Universidad Abad Oliva CEU"
"Echar a Vanesa Nevado-Sancho","Febe Arroyo Saavedra",Matemática,"Universidad Autónoma de Barcelona"
"Denunciar a Osvaldo Badía Bernad","Flor Vigil Feijoo",Psicología,"Universidad de Jaén"
"Echar a Federico Pérez Cuéllar","Berto Vera",Matemática,"Universidad Internacional Isabel I de Castilla"
"Echar a Tatiana Araujo Arjona","Emigdio Camino Borja",Comunicación,"Universidad Autónoma de Barcelona"
"Echar a Micaela Marcos Sabater","Áurea Liliana Lopez Casanovas","Ciencias Físicas y Matemáticas","Universidad de Cádiz"
"Hablar con Pastor Novoa Abellán","Lino Nuñez-Carbajo","Ciencias Económicas","Universidad Pública de Navarra"
"Denunciar a Encarnita Ledesma Bermudez","Nacho Iglesias Higueras",Ingeniería,"Universidad de Burgos"
"Hablar con Norberto Salazar Aragón","Andrés Felipe Escrivá Sainz","Ciencias de la Educación","Universidad de La Coruña"
"Echar a Gaspar Manuel","Diana de Barriga","Ciencias de la Salud","Universidad de Almería"
"Hablar con Antonio Sierra Ugarte","Carmela Vizcaíno",Filosofía,"Universidad Politécnica de Cartagena"
"Denunciar a Rodolfo Pintor Oliveras","Montserrat Blanca Guardiola Esteve",Química,"Universidad de León"
"Hablar con Manu Sastre Porcel","Petrona Ferrer Burgos","Ciencias Exactas","Universidad de La Laguna"
"Denunciar a Eliseo Ángel Reguera","Dafne Sales Frías",Medicina,"Universidad de Diseño, Innovación y Tecnología"
"Hablar con Guillermo Mate Exposito","Eusebia Espada-Sanabria",Medicina,"Universidad Fernando Pessoa-Canarias"
"Denunciar a Balduino Martinez Cid","Judith García Leiva",Ingeniería,"Universidad Abad Oliva CEU"
"Quitar el busto de Fermín Maza Bautista","Clemente Carbó",Diseño,"Universidad Jaime I"
"Hablar con Matías Galindo Almagro","Cayetano Solís-Tormo",Comunicación,"Universidad de Diseño, Innovación y Tecnología"
"Echar a Sebastian Sierra-Hernández","Joaquina Sobrino León",Arquitectura,"CUNEF Universidad"
"Quitar el busto de Guiomar Aguirre-Folch","Azucena Cortes Miró",Matemática,"Universidad de Sevilla"
"Quitar el busto de Isabel Ribas Moraleda","Almudena Mateo Leiva",Diseño,"Universidad de Mondragón"
"Hablar con Máximo Gabino Ibañez Mena","Jenny del Porta",Comunicación,"Universidad de Valladolid"
"Hablar con José Antonio Andrade Alonso","Reyes de Caparrós","Ciencias Exactas","Universidad de Cantabria"
"Denunciar a Jeremías Caro Mate","Jonatan del Ribes",Matemática,"Universidad de Gerona"
"Denunciar a Inés Neira Tomé","Dolores Olmedo-Carbó","Ciencias Físicas y Matemáticas","Universidad Loyola Andalucía"
"Echar a Luna Vendrell Carbonell","Silvio Bas Montoya",Arquitectura,"Universidad Politécnica de Cartagena"
"Denunciar a Alberto Giner Trillo","Adelia Gertrudis Enríquez Aragón",Matemática,"Universidad Pompeu Fabra"
"Echar a Plácido Criado Mena","Ale de Agustín","Educación Física","Universidad Fernando III"
"Echar a Telmo Elías-Ramirez","Dionisio Hervás Olmedo",Química,"Universidad Europea Miguel de Cervantes"
"Echar a Pablo de Blázquez","Sandra del Estrada","Ciencias Exactas","Universidad Internacional Villanueva"
"Quitar el busto de Amor Quintero Moreno","Ana Sofía Zamorano Contreras","Educación Física","Universidad de Valencia"
"Echar a Jessica Busquets Cal","Alba Piñeiro",Comunicación,"Universidad de Sevilla"
"Hablar con Godofredo Zurita Sáenz","Filomena Velázquez Aller",Psicología,"Universidad CEU Cardenal Herrera"
"Hablar con Rubén Gras Pino","Ale Gargallo Segovia","Ciencias Exactas","Universidad Internacional de la Empresa"
"Hablar con Iker Cañizares Caparrós","Lupe Valdés Mosquera",Humanidades,"Universidad Europea del Atlántico"
"Echar a Arcelia Leire Portero Segarra","María Ángeles Llorente Villar",Diseño,"Universidad de Valencia"
"Echar a Leyre Asensio Alfaro","Esperanza Vilaplana Galiano","Ciencias Físicas y Matemáticas","Universidad de Santiago de Compostela"
"Echar a Tatiana Gisbert Casanovas","Anita Meléndez Ramirez",Humanidades,"Universidad Internacional de Andalucía"
"Quitar el busto de Enrique Merino","Lilia Pelayo Pont",Química,"Universidad Pontificia Comillas"
"Denunciar a Emiliana Elena Carrillo Pozo","Blas Valero Valls","Ciencias Sociales","Universidad Internacional de Valencia"
"Echar a Cayetano Bravo Reguera","Timoteo Lopez Jáuregui",Odontología,"Universidad de Alcalá"
"Denunciar a Maricela Rosa Azorin","Caridad Bernal Pacheco",Filosofía,"Universidad de Navarra"
"Quitar el busto de Emiliana Hoyos Teruel","Íngrid Perelló Baquero","Educación Física","Universidad de Valencia"
"Echar a América Mena Murcia","Elvira Toro Teruel",Veterinaria,"Universidad de León"
"Echar a Abril Piñol Marcos","Juan Antonio Abascal Salmerón",Matemática,"Universidad San Jorge"
"Hablar con Cornelio Conesa Perez","Wilfredo Reig Barbero",Odontología,"Universidad de Murcia"
"Hablar con Mireia del Hoz","Rufina de Jover","Ciencias Físicas y Matemáticas","Universidad Católica San Antonio"
"Quitar el busto de Luciana Parra Ferrero","Cipriano Angulo-Morillo",Derecho,"Universidad de Extremadura"
"Denunciar a Aníbal Pellicer-Durán","Rodrigo Agullo Español",Arquitectura,"Universidad Europea de Valencia"
"Echar a Severo Leonel Benet Rocha","Édgar Narváez Hurtado",Filosofía,"Universidad de Sevilla"
"Denunciar a Eustaquio Casanovas Vara","Óscar Fernández Frías","Ciencias Físicas y Matemáticas","Universidad Europea de Canarias"
"Denunciar a Débora Gómez","Dolores Olmedo-Carbó","Ciencias Físicas y Matemáticas","Universidad Loyola Andalucía"
"Denunciar a Salomé Catalá","Clara Arrieta-Téllez","Ciencias Económicas","Universidad de Sevilla"
"Echar a Reinaldo Quintanilla Cabrero","Celestino Samuel Esparza Robledo","Ciencias Físicas y Matemáticas","Universidad Internacional Isabel I de Castilla"
"Echar a Pía Requena Arjona","Ileana Sabater Anaya",Odontología,"Universidad Politécnica de Cartagena"
"Echar a Odalis Ferrero Fernandez","Sarita Vidal Blázquez",Agronomía,"Universidad de Extremadura"
"Denunciar a Adelia Villa Cózar","Jacobo Galiano Bustamante","Ciencias de la Educación","Universidad de Valencia"
"Denunciar a Paulino Campo Cervera","Ovidio Elorza Bartolomé",Química,"CUNEF Universidad"
"Denunciar a Glauco Valero Escrivá Puente","Aníbal Amorós Mayo",Derecho,"Universidad de Vigo"
"Quitar el busto de Edelmira Jove Maza","Gabriela Goicoechea Mateu",Arquitectura,"Universidad de Murcia"
"Denunciar a Adán Nadal Quesada","Salomé Girona Sotelo","Educación Física","Universidad de Las Palmas de Gran Canaria"
"Denunciar a Alma Ribas Coronado","Ximena Alegria Anglada",Diseño,"Universidad de Mondragón"
"Quitar el busto de Néstor Humberto Mora Cabo","Amílcar Recio Heras","Ciencias de la Educación","Universidad del País Vasco"
"Hablar con Ibán Torrecilla-Fuster","Jose Hernández Soler","Ciencias Sociales","Universidad Carlos III de Madrid"
"Quitar el busto de Salomé del Ricart","Ezequiel Oliva Martín",Derecho,"Universidad de Diseño, Innovación y Tecnología"
"Echar a Teresa del Ródenas","Joaquín Collado Tena",Química,"Universidad Loyola Andalucía"
"Hablar con Pacífica Merche Bayona Jaén","Ruy Corbacho Llorente","Ciencias Físicas y Matemáticas","Universidad de Santiago de Compostela"
"Echar a Gabriela de Pastor","Reina Sabater",Diseño,"Universidad Autónoma de Barcelona"
"Quitar el busto de Olga Dominguez Goñi","Julie Arteaga Caparrós",Derecho,"Universidad de Vigo"
"Denunciar a Régulo Aguilera Julián","Andrés Felipe Caparrós Manzano","Ciencias de la Salud","Universidad Rovira i Virgili"
"Denunciar a Victorino Granados Murillo","Luis Macías Bilbao",Química,"Universidad de Las Palmas de Gran Canaria"
"Hablar con Nazario Costa Arteaga","Hilda Aller-Montalbán","Ciencias de la Educación","Universidad de Navarra"
"Hablar con Miriam Díaz Sarmiento","Josefa Benitez Muro",Veterinaria,"Universidad de Burgos"
"Hablar con Lope Gilberto Sanchez Álamo","Cornelio de Blanch",Odontología,"Universidad Politécnica de Cartagena"
"Hablar con Adalberto Domingo Sarabia","Reyna Florinda Borrego Iglesia",Ingeniería,"Universidad de León"
"Quitar el busto de Yésica Rosenda Buendía Bosch","Chema Alberola",Química,"Universidad Internacional Menéndez Pelayo"
"Quitar el busto de Eleuterio de Rodrigo","Donato Escrivá-Núñez",Diseño,"Universidad Intercontinental de la Empresa"
"Hablar con Anselmo de Ricart","Marianela Flores-Zurita",Información,"Universidad CEU San Pablo"
"Quitar el busto de Amor Vallejo Diez","Carmela Crespi Molins",Agronomía,"Universidad de Santiago de Compostela"
"Echar a Paz Rincón","Joan de Saldaña",Humanidades,"Universidad de las Islas Baleares"
"Denunciar a Fortunato Jove Solana","Arturo Quintanilla-Soler",Agronomía,"Universidad de Salamanca"
"Denunciar a Cebrián Contreras Sarmiento","René Falcó","Ciencias de la Educación","Universidad Internacional de La Rioja"
"Hablar con Leticia Criado Peñalver","Marisa de Peral",Derecho,"Universidad de Las Palmas de Gran Canaria"
"Quitar el busto de Espiridión Elorza","Pilar Mayol Artigas","Ciencias de la Salud","Universidad Rey Juan Carlos"
"Denunciar a Julieta Peñas Meléndez","Melisa Castell Figueras",Arquitectura,"Universidad IE"
"Quitar el busto de Elías Ropero Pedrosa","Román del Mateu",Matemática,"Universidad Internacional Villanueva"
"Hablar con Flor Jesusa Calatayud Manso","Elvira Alba Pelayo Álvarez",Información,"Universidad CEU San Pablo"
"Denunciar a Sara Garmendia Villalba","Urbano del Campos",Agronomía,"Universidad Pompeu Fabra"
"Echar a Nicolás Gil-Alarcón","Estrella Capdevila Jurado","Ciencias Exactas","Universidad Eclesiástica San Dámaso"
"Quitar el busto de Javiera Feliciana Salvador Viña","Eusebia Espada-Sanabria",Medicina,"Universidad Fernando Pessoa-Canarias"
"Denunciar a Hipólito Fuentes Bernal","Adolfo Alba-Cabrero",Química,"Universidad de Lérida"
"Hablar con Malena Toledo Álamo","Leonardo Gras Villalobos",Humanidades,"Universidad de Vigo"
"Hablar con Onofre del Rosa","Matilde Rojas Garcés",Arquitectura,"Universidad Rovira i Virgili"
"Quitar el busto de Lucio Córdoba","Oriana Fonseca-Alegria",Arquitectura,"Universidad Pablo de Olavide"
"Denunciar a Buenaventura Luís Barón Giner","Rebeca de Zaragoza",Información,"Universidad de Deusto"
"Hablar con Leonor Martorell","Claudia Cal Posada",Matemática,"Universidad CEU San Pablo"
"Echar a Aureliano Puente Palomino","Delia Toledo Martín",Diseño,"Universidad Eclesiástica San Dámaso"
"Hablar con Ainoa Vicens Arranz","Tamara Talavera",Odontología,"Universidad Eclesiástica San Dámaso"
"Echar a Renata Carrión Albero","Ruperto de Arnaiz",Derecho,"Universidad de Zaragoza"
"Quitar el busto de Lupe Silvio Benavides Gimeno","Aristides de Amor","Ciencias Físicas y Matemáticas","Universidad de Valencia"
"Quitar el busto de Ciro Pons Silva","Aurelia Granados-Gras","Educación Física","Universidad Pública de Navarra"
"Echar a Renata Bello Córdoba","Alba Chacón Sanmartín",Medicina,"Universidad de Extremadura"
"Echar a Leticia Orozco-Lillo","Emilio Mariño Gimenez","Educación Física","Universidad Fernando Pessoa-Canarias"
"Hablar con Hernando de Aguilera","Mohamed Lopez Acevedo","Ciencias Sociales","Universidad de Sevilla"
"Denunciar a Vidal del Galindo","Jennifer Olivares Anaya",Información,"Universidad CEU San Pablo"
"Denunciar a Rosalinda Roldan Muñoz","Amor Belmonte Alcalde",Química,"Universidad Internacional de Andalucía"
"Denunciar a Pedro Colomer-Cañizares","Angelino Quintanilla","Ciencias Sociales","Universidad de Oviedo"
"Denunciar a Lope Angulo-Montero","Conrado Viñas Canals",Humanidades,"Universidad Ramon Llull"
"Hablar con Lupe Redondo Barrera","Rolando Mohamed Caparrós Agudo",Humanidades,"Universidad de Salamanca"
"Echar a Teodoro Cifuentes Prats","Felicia Colom Ariza","Ciencias Económicas","Universidad Jaime I"
"Hablar con Armida Coca Cabo","Carla Guillén Peña","Ciencias Sociales","Universidad de Santiago de Compostela"
"Quitar el busto de Ruy Galindo Ariza","Bárbara Vila Villegas","Ciencias Físicas y Matemáticas","Universidad de Cádiz"
"Echar a Sarita de Bou","Fidela Abril",Medicina,"Universidad Europea de Madrid"
"Denunciar a Hilda Margarita Valls Bonet","Clotilde Tur Juárez","Ciencias Económicas","Universidad Nacional de Educación a Distancia"
"Hablar con Ulises Ros","Candela Bueno Pascual","Educación Física","Universidad Católica de Valencia San Vicente Mártir"
"Echar a África Moles Codina","Liliana Zoraida Mercader Bou",Odontología,"Universidad Católica de Valencia San Vicente Mártir"
"Quitar el busto de Leoncio Gras Segarra","Lola Ferrán Benítez",Agronomía,"Universidad Católica Santa Teresa de Jesús de Ávila"
"Hablar con Graciana Crespi-Tolosa","Norberto Duilio Iriarte Bas","Ciencias Sociales","Universidad Rey Juan Carlos"
"Quitar el busto de Buenaventura Sabater Calatayud","Melania Villena-Belda",Humanidades,"Universidad de La Laguna"
"Quitar el busto de Humberto Tenorio Castrillo","Bautista Cabrero Roig",Derecho,"Universidad Europea del Atlántico"
"Denunciar a Vicenta Narcisa Ramirez Ballesteros","Iris Plaza-Caballero","Ciencias Sociales","Universidad Católica de Valencia San Vicente Mártir"
"Denunciar a Tomás Gonzalez","Donato Andreu Castellanos","Educación Física","Universidad Abierta de Cataluña"
"Hablar con Leocadio Sevilla Manjón","Carla Salom Mas",Psicología,"Universidad de Murcia"
"Quitar el busto de Berta Casanovas Soria","Clotilde Villanueva Lobo",Derecho,"Universidad San Jorge"
"Hablar con Iván Bayona Luna","Teobaldo Boix Roura","Ciencias de la Educación","Universidad de Lérida"
"Echar a Vidal Bermudez Pons","José Luis Maestre Montero",Filosofía,"Universidad de La Rioja"
"Echar a Amelia Calatayud","Adelia Montero Ribes",Información,"Universidad Complutense de Madrid"
"Echar a Leocadio Alcázar","Graciela Báez Castell",Filosofía,"CUNEF Universidad"
"Denunciar a Georgina Teruel Armas","Julieta Tejedor Espada",Derecho,"Universidad de Barcelona"
"Echar a Héctor Torralba Casals","María Del Carmen Cases Camps","Ciencias Exactas","Universidad CEU Cardenal Herrera"
"Echar a Amado Tapia Asenjo","René Torrijos","Ciencias Sociales","Universidad Politécnica de Cataluña"
"Quitar el busto de África Flavia Mendoza Flores","Benigno Vizcaíno-Noguera","Ciencias Económicas","Universidad Rey Juan Carlos"
"Hablar con Rocío Cáceres","Eduardo Abellán Silva",Derecho,"Universidad de Murcia"
"Echar a Vera del Manso","Basilio Mariano España Contreras",Diseño,"Universidad de Cantabria"
"Hablar con Victor Esteve Escamilla","Balduino Abella Cases",Derecho,"Universidad de Málaga"
"Echar a Alicia Olmo Sanz","Guiomar Vilma Cámara Osorio",Agronomía,"Universidad de León"
"Denunciar a Isabel de Jaume","Benita Balaguer",Comunicación,"Universidad de Valencia"
"Denunciar a Melisa Pascual Ortiz","Georgina Vilar Echevarría",Diseño,"Universidad Rey Juan Carlos"
"Hablar con Elvira Giralt Losada","Prudencio de Caballero",Psicología,"Universidad a Distancia de Madrid"
"Denunciar a Gastón Carlos Pavón","Lorenzo Ibán Acuña Bustos",Odontología,"Universidad de Huelva"
"Echar a Susanita Iglesias Ferrera","Lalo Herrero",Diseño,"Universidad Rovira i Virgili"
"Denunciar a Marisa Heredia","Jose Manuel Urrutia Vázquez",Humanidades,"Universidad de León"
"Echar a Odalys del Maestre","Josep Escobar Roldán",Agronomía,"Universidad de Valencia"
"Hablar con Estrella Castell Lucena","Ricarda Carmona Díez",Veterinaria,"Universidad de Lérida"
